{ "heroTitle":"Título","heroSubtitle":"Subtítulo","heroCta":"Agendar","painPoints":["Dor 1","Dor 2","Dor 3"],"benefits":[{"title":"B1","description":"D1"},{"title":"B2","description":"D2"},{"title":"B3","description":"D3"}],"socialProofHook":"Prova","offerSection":"Oferta","footerCta":"Agendar reunião" }
